{
  "schemaVersion": 1,
  "fixtureId": "economy_first_30_minutes",
  "contentVersion": "0.3.0",
  "input": {
    "activeSeconds": 1800,
    "offlineSeconds": 0,
    "purchases": [
      "cutter_2",
      "rivet_2",
      "sorter_repair"
    ]
  },
  "expectedState": {
    "activeSecondsApplied": 1767,
    "highestClearedStage": 59,
    "totalActiveClears": 59,
    "purchasedSinkIds": [
      "cutter_2",
      "rivet_2",
      "sorter_repair"
    ],
    "offlineSecondsApplied": 0,
    "offlineCycles": 0,
    "offlineReward": {
      "credits": 0,
      "parts": 0,
      "circuits": 0,
      "alloy": 0,
      "starCores": 0
    },
    "wallet": {
      "credits": 359963,
      "parts": 981,
      "circuits": 66,
      "alloy": 25,
      "starCores": 0
    },
    "launchEligible": false,
    "launchMissing": {
      "credits": 39640037,
      "parts": 1419,
      "circuits": 0,
      "alloy": 0,
      "starCores": 1
    },
    "walletAfterLaunch": {
      "credits": 359963,
      "parts": 981,
      "circuits": 66,
      "alloy": 25,
      "starCores": 0
    }
  },
  "expectedDigest": "7eb75460a2a2588822a55093e7171107ea1aebeafd390691622f46b9c9751e6f"
}
